{
  "schema_version": "0.2-pilot",
  "experiment": "E1",
  "run_id": "E1F-C22-L1-strong-R003",
  "case_id": "C22",
  "rendering_id": "C22-L1",
  "rendering_level": "L1",
  "model_role": "strong",
  "requested_model": "gemini-3.8-flash",
  "provider_model": "gemini-3.8-flash",
  "provider_status": "completed",
  "execution_config_version": "1.0-pilot",
  "success": true,
  "response_text": "{\n  \"controls\": [\n    \"ENHANCED_FINANCIAL_APPROVAL\",\n    \"CONTRACT_REVIEW\"\n  ]\n}",
  "parsed_response": {
    "controls": [
      "ENHANCED_FINANCIAL_APPROVAL",
      "CONTRACT_REVIEW"
    ]
  },
  "usage": {
    "input_tokens_by_modality": [
      {
        "modality": "text",
        "tokens": 811
      }
    ],
    "total_cached_tokens": 0,
    "total_input_tokens": 811,
    "total_output_tokens": 31,
    "total_thought_tokens": 402,
    "total_tokens": 1244,
    "total_tool_use_tokens": 0,
    "raw_prompt_token": 985,
    "model_invocation_token_counts": [
      {
        "prompt_tokens_details": [
          {
            "modality": "text",
            "tokens": 985
          }
        ],
        "candidates_tokens_details": [
          {
            "modality": "text",
            "tokens": 47
          }
        ],
        "thoughts_tokens_details": [
          {
            "modality": "text",
            "tokens": 402
          }
        ]
      }
    ],
    "non_grounding_model_invocation_token_counts": [
      {
        "prompt_tokens_details": [
          {
            "modality": "text",
            "tokens": 985
          }
        ],
        "candidates_tokens_details": [
          {
            "modality": "text",
            "tokens": 47
          }
        ],
        "thoughts_tokens_details": [
          {
            "modality": "text",
            "tokens": 402
          }
        ]
      }
    ]
  },
  "request": {
    "temperature": 0,
    "thinking_level": "low",
    "store": false,
    "prompt": "AUTHORITATIVE POLICY\n\nE1 SYNTHETIC PROCUREMENT AND INFORMATION-RISK POLICY\nVersion 1.0\n\nPURPOSE\n\nThis policy defines the controls that apply to procurement requests based on\npurchase value, supplier status, information classification, deployment model,\ncontract duration, and approved exceptions.\n\nAll applicable controls must be identified unless the request is prohibited.\n\n\n1. FINANCIAL AUTHORITY\n\nEvery non-prohibited procurement request requires exactly one financial\napproval.\n\n1.1 A purchase with a value of USD 50,000 or less requires:\n\nSTANDARD_FINANCIAL_APPROVAL\n\n1.2 A purchase with a value greater than USD 50,000 and less than or equal to\nUSD 100,000 requires:\n\nENHANCED_FINANCIAL_APPROVAL\n\n1.3 A purchase with a value greater than USD 100,000 requires:\n\nSENIOR_FINANCIAL_APPROVAL\n\n\n2. SUPPLIER CONTROLS\n\n2.1 An approved supplier requires no additional supplier control.\n\n2.2 An unapproved supplier requires:\n\nSUPPLIER_DUE_DILIGENCE\n\nThis requirement does not apply if there is an approved exception whose scope\ncovers the vendor requirement.\n\n2.3 A prohibited supplier results in:\n\nPROHIBITED\n\nA prohibited-supplier determination is terminal. If the supplier is prohibited,\nthe request is prohibited and no other controls are returned.\n\nA normal approved exception cannot override a prohibited-supplier\ndetermination.\n\n\n3. INFORMATION-RISK CONTROLS\n\n3.1 Public or internal information requires no additional information-security\ncontrol under this policy.\n\n3.2 Confidential information processed using an external SaaS deployment\nrequires:\n\nSECURITY_REVIEW\n\n3.3 Restricted information processed using an external SaaS deployment\nrequires:\n\nENHANCED_SECURITY_REVIEW\n\nThis requirement does not apply if there is an approved exception whose scope\ncovers external processing of restricted information.\n\n3.4 Restricted information processed using an internal deployment requires:\n\nSECURITY_REVIEW\n\n\n4. CONTRACT-DURATION CONTROL\n\nA contract with a duration greater than 24 months requires:\n\nCONTRACT_REVIEW\n\nA contract of exactly 24 months does not require CONTRACT_REVIEW under this\nrule.\n\n\n5. EXCEPTIONS\n\nFor purposes of this policy, an exception is either absent or approved.\n\nAn approved exception must have an explicit scope. The permitted scopes are:\n\nvendor\nexternal_restricted_data\nboth\n\nAn exception has effect only when it is approved and only within its stated\nscope.\n\n5.1 An approved exception with scope \"vendor\" suppresses only:\n\nSUPPLIER_DUE_DILIGENCE\n\n5.2 An approved exception with scope \"external_restricted_data\" suppresses\nonly:\n\nENHANCED_SECURITY_REVIEW\n\nwhen that control arises from restricted information being processed using an\nexternal SaaS deployment.\n\n5.3 An approved exception with scope \"both\" suppresses both of the controls\ndescribed in sections 5.1 and 5.2 when they would otherwise apply.\n\n5.4 No exception defined by this policy suppresses:\n\nSTANDARD_FINANCIAL_APPROVAL\nENHANCED_FINANCIAL_APPROVAL\nSENIOR_FINANCIAL_APPROVAL\nSECURITY_REVIEW\nCONTRACT_REVIEW\nPROHIBITED\n\n\n6. OUTPUT REQUIREMENT\n\nFor a permitted request, identify all controls required by this policy.\n\nFor a prohibited request, return only:\n\nPROHIBITED\n\nCASE\n\nThe purchase costs USD 80,000. The supplier is unapproved. The information is classified as restricted. The service will use external SaaS. The contract is for 30 months. An approved exception covers both the vendor approval requirement and external processing of restricted information.\n\nTASK\n\nDetermine all controls required by the authoritative policy for this case.\nReturn only the required controls using the supplied response schema.\n"
  },
  "automatic_retry": false,
  "latency_ms": 2609.8752999678254,
  "sdk_version": "2.25.0",
  "public_projection_schema": "research-observation-1.0",
  "actual_provider_charge_usd": null,
  "actual_provider_charge_sgd": null
}
